{
    "metadata": {
        "type": "tabular",
        "n_rows": 100,
        "columns": [
            {
                "name": "Age",
                "dtype": "int64",
                "n_unique": 33,
                "missing": 0.0
            },
            {
                "name": "Gender",
                "dtype": "float64",
                "n_unique": 2,
                "missing": 0.0
            },
            {
                "name": "Blood Type",
                "dtype": "float64",
                "n_unique": 8,
                "missing": 0.0
            },
            {
                "name": "Medical Condition",
                "dtype": "float64",
                "n_unique": 6,
                "missing": 0.0
            },
            {
                "name": "Billing Amount",
                "dtype": "float64",
                "n_unique": 100,
                "missing": 0.0
            },
            {
                "name": "Admission Type",
                "dtype": "float64",
                "n_unique": 3,
                "missing": 0.0
            },
            {
                "name": "Medication",
                "dtype": "float64",
                "n_unique": 5,
                "missing": 0.0
            },
            {
                "name": "Test Results",
                "dtype": "float64",
                "n_unique": 3,
                "missing": 0.0
            }
        ]
    },
    "task": {
        "task": "unsupervised",
        "confidence": 0.5
    },
    "pipeline": {
        "pipeline": "unknown"
    },
    "theory": {
        "rules": [],
        "llm": "### Potential Scientific Insights from the Dataset\nGiven the dataset metadata describing a tabular dataset with patient information (Age, Gender, Blood Type, Medical Condition, etc.) and a suggested unsupervised learning task, several potential scientific insights can be explored.  The small sample size (100 rows) should be kept in mind, limiting the generalizability of findings.\n**1. Latent Patient Groups and their Characteristics:**\n* **Insight:** Applying clustering algorithms (e.g., k-means, DBSCAN, hierarchical clustering) could reveal the existence of latent subgroups within the patient population based on their combined characteristics.  The optimal number of clusters could be determined using techniques like the elbow method or silhouette analysis.\n* **Scientific Relevance:** Discovering these subgroups could highlight previously unknown correlations between demographic factors (Age, Gender, Blood Type), medical conditions, treatment types (Medication, Admission Type), and billing amounts. This could lead to a better understanding of patient stratification and inform targeted treatment strategies or resource allocation. For example, one cluster might represent patients with a specific medical condition requiring expensive medication and long hospital stays, while another cluster might have a different profile.\n* **Limitations:** The interpretability of the clusters will depend heavily on the chosen algorithm and feature scaling.  The small sample size might limit the reliability and generalizability of identified clusters.  Careful consideration of feature engineering might be necessary to optimize clustering performance.\n\n**2. Relationships between Medical Conditions, Treatments, and Billing:**\n* **Insight:**  Dimensionality reduction techniques (e.g., Principal Component Analysis (PCA), t-SNE) could be used to visualize the high-dimensional data and identify potential relationships between medical conditions, types of medication prescribed, admission types, and billing amounts.\n* **Scientific Relevance:**  This approach could help uncover hidden patterns and dependencies.  For example, PCA might reveal a strong correlation between certain medical conditions, specific medications, and higher billing amounts, suggesting potential areas for cost optimization or improved treatment protocols.  Visualizing the data through t-SNE might reveal distinct clusters of patients with similar treatment pathways and associated costs.\n* **Limitations:** PCA assumes linear relationships between variables, which might not be the case in this complex medical context. t-SNE is better for visualization but less useful for quantitative analysis.  The interpretability of the reduced dimensions needs careful consideration.\n\n**3. Association Rule Mining for Treatment Patterns:**\n* **Insight:**  Association rule mining algorithms (e.g., Apriori, FP-Growth) could be applied to discover frequent itemsets and association rules between different medical conditions, medications, and admission types.\n* **Scientific Relevance:** This could reveal common treatment pathways and potential dependencies. For example, a rule might show a strong association between a specific medical condition, a particular medication, and a specific admission type.  This information can be used to improve clinical decision-making, optimize treatment protocols, and predict future treatment needs.\n* **Limitations:** Association rule mining might suffer from the sparsity of the data due to the relatively small sample size.  The identified rules might not be statistically significant and should be interpreted cautiously.  Support and confidence thresholds need careful tuning to avoid generating irrelevant rules.\n\nThese insights are preliminary and require further analysis using appropriate machine learning techniques. The small sample size necessitates careful validation and consideration of the limitations.  Further data collection would significantly enhance the reliability and generalizability of any findings."
    }
}