{
    "metadata": {
        "type": "tabular",
        "n_rows": 100,
        "columns": [
            {
                "name": "image_url",
                "dtype": "object",
                "n_unique": 100,
                "missing": 0.0
            },
            {
                "name": "camera_or_phone_prob",
                "dtype": "float64",
                "n_unique": 2,
                "missing": 0.0
            },
            {
                "name": "food_prob",
                "dtype": "float64",
                "n_unique": 4,
                "missing": 0.0
            },
            {
                "name": "dish_name",
                "dtype": "object",
                "n_unique": 91,
                "missing": 0.0
            },
            {
                "name": "food_type",
                "dtype": "object",
                "n_unique": 4,
                "missing": 0.0
            },
            {
                "name": "ingredients",
                "dtype": "object",
                "n_unique": 100,
                "missing": 0.0
            },
            {
                "name": "portion_size",
                "dtype": "object",
                "n_unique": 100,
                "missing": 0.0
            },
            {
                "name": "nutritional_profile",
                "dtype": "object",
                "n_unique": 78,
                "missing": 0.0
            },
            {
                "name": "cooking_method",
                "dtype": "object",
                "n_unique": 52,
                "missing": 0.02
            },
            {
                "name": "sub_dt",
                "dtype": "int64",
                "n_unique": 28,
                "missing": 0.0
            }
        ]
    },
    "task": {
        "task": "unsupervised",
        "confidence": 0.5
    },
    "pipeline": {
        "pipeline": "unknown"
    },
    "theory": {
        "rules": [],
        "llm": "## Scientific Insights from Dataset Metadata\nBased on the provided metadata, here are three potential scientific insights that could be explored using unsupervised learning techniques:\n### 1. Latent Structure of Food Images and Descriptions:\n**Insight:**  The dataset contains a rich combination of image data (implied by `image_url`), textual descriptions (`dish_name`, `ingredients`), and categorical features (`food_type`, `cooking_method`). Unsupervised learning methods like clustering (e.g., k-means, DBSCAN, hierarchical clustering) could reveal latent structures within this data.  For example, we might discover clusters of images and descriptions corresponding to specific culinary traditions, ingredient combinations, or visual styles.  Dimensionality reduction techniques (e.g., t-SNE, UMAP) could then visualize these clusters, offering insights into the underlying organization of the food data.  The relatively high unique counts for `dish_name` and `ingredients` suggest a high level of variability and potential for discovering meaningful clusters.\n**Methodology:** Apply clustering and dimensionality reduction to a combined representation of image features (extracted from the URLs) and text features (e.g., TF-IDF vectors of `dish_name` and `ingredients`).  Analyze the resulting clusters for interpretable patterns.  Consider the impact of `food_type` and `cooking_method` on the cluster structure.\n\n### 2.  Relationship between Image Source and Food Characteristics:\n**Insight:** The `camera_or_phone_prob` feature offers a potential link between the origin of the image (professional camera vs. phone) and characteristics of the depicted food. Unsupervised methods could investigate if images from professional cameras tend to be associated with certain `food_type`, `portion_size`, or `nutritional_profile` categories. This could reveal biases in how different types of food are photographed or presented, reflecting potential societal or cultural patterns.\n**Methodology:** Utilize correlation analysis to examine the relationship between `camera_or_phone_prob` and other numerical features (potentially creating numerical representations for categorical features). Visualizations like box plots or scatter plots can illustrate the relationship between the probability and the other variables.  Additionally, conditional probability analysis can explore the relationship between `camera_or_phone_prob` and categorical features.\n\n### 3.  Temporal Patterns in Food Preparation:\n**Insight:** The `sub_dt` feature, representing a time component (likely a subset of date and time), suggests the possibility of uncovering temporal patterns in the data.  For example, are certain food types or cooking methods more prevalent at specific times of the year or day?  Unsupervised time series analysis methods or techniques like self-organizing maps (SOMs) could reveal patterns in the frequency of different food categories over time.\n**Methodology:**  Analyze the distribution of `food_type` and `cooking_method` across different values of `sub_dt`.  Visualize these distributions using time series plots.  Consider more advanced techniques like change point detection to identify significant shifts in food preparation patterns over time.  Further analysis could incorporate other features like `dish_name` and `ingredients` to see how temporal patterns affect specific dish preparation.\n\nThese insights require careful consideration of the relatively small sample size (100 rows) and potential biases in the data.  Appropriate data preprocessing and validation are crucial. The \"unknown\" pipeline suggests the need for exploratory analysis to determine the best unsupervised learning approach for each insight."
    }
}